person,job,label,theme,text,date,lemmatized_text
שלמה קרעי,חבר כנסת הליכוד,4,על כוונות הקואליציה החדשה,"הם מחוקקים חוק בקווי היסוד שלהם בהסכמים הקואליציונים שלא רק להגביל את הכהונה שלו כראש ממשלה, שהוא לא יוכל בכלל להתמודד בכנסת",2021-06-14,"הוא חוקק חוק ב קו ה יסוד של הם ב ה הסכם ה קואליציונים ש לא רק הגביל את ה כהונה של הוא כ ראש מ משל , ש הוא לא יכול בכלל התמודד ב ה כנסת"
מנסור עבאס,"יו""ר רע""מ הרשימה המשותפת",3,"על הצטרפות רע""ם לקואליציה",זאת פעם ראשונה שמפלגה ערבית שותפה להקמת ממשלה,2021-06-02,זאת פעם ראשון ש מפלגה ערבי שותף ל הקמה ממשלה
ינון אזולאי,"חבר כנסת ש""ס",4,על חלוקת התפקידים בקואליציה,אני עדיין לא ראיתי ממשלה ששניים מאותה מפלגה לוקחים גם את ועדת כספים וגם את משרד האוצר,2021-05-25,הוא עדיין לא ראה מ משל ש שני מ את היא מפלגה לקח גם את ועדה כסף ו גם את משרד ה אוצר
מוחמד ברכה,"יו""ר ועדת המעקב של ערביי ישראל",5,על פגיעה בבתי כנסת בלוד,לא הייתה פגיעה בשום בית כנסת בלוד,2021-05-25,לא היה פגיעה ב שום בית כ נס ב ה לוד
מירב בן-ארי,חברת כנסת יש עתיד,5,על הכוונה לחסן בני נוער,"רוצים לחסן ילדים על-סמך ניסוי שנוסה על 2,200 ילדים. אין הצדקה אפידמיולוגית קלינית לחסן ילדים וידוע שהם לא מדביקים",2021-05-23,"רצה חיסן ילד על סמך ניסוי ש נוסה על 2,200 ילד . אין ה צדקה אפידמיולוגיה קליני חיסן ילד ו ידוע ש הוא לא הדביק"
אלי כהן,שר המודיעין הליכוד,4,על גידול האוכלוסייה בעוטף עזה,במהלך העשור האחרון עוטף עזה הפך לאזור פורח עם כמעט הכפלה של האוכלוסייה שנמצאת שם,2021-05-18,ב מהלך ה עשור ה אחרון עטף עז הפך ל אזור פורח עם כמעט הכפלה של ה אוכלוסייה ש נמצא שם
מירי רגב,שרת התחבורה הליכוד,2,על הכספים הקטאריים לחמאס,"הכסף הזה עבר בתקופתו של ליברמן, בתקופתו של בוגי",2021-05-17,"ה כסף ה זה עבר ב תקופה של ליברמן , ב תקופה של בוגי"
עיסאווי פריג',חבר כנסת מרצ,2,על עליית יהודים להר הבית,בסטטוס קוו שהיה עד שנת 2000 מבקרים יהודים יכולים לעלות להר הבית,2021-05-10,ב ה סטטוס קיווה שהייה עד שנה 2000 מבקר יהודי יכול עלה ל הר ה בית
אבי דיכטר,חבר כנסת הליכוד,0,על השקפת העולם של מרצ,מרצ דרשה להחליף את המנון התקווה באינטרנציונל,2021-05-06,מרצ דרש החליף את המנון ה תקווה ב אינטרנציונל
שמחה רוטמן,חבר כנסת הציונות הדתית,1,"על האפשרות להקים ממשלה בתמיכת רע""ם",ממשלת מיעוט מעולם לא קמה במדינת ישראל,2021-05-03,ממשלה מיעוט מעולם לא קם ב מדינה ישראל
אמילי מואטי,חברת כנסת העבודה,1,על התגובה לביטול משפטו של רוצח שרה אלימי בצרפת,"לפי החוק הישראלי, אזרח ישראלי יכול לפנות לבימש על עבירה [בחול] על רקע אנטישמי",2021-04-23,"לפי ה חוק ה ישראלי , איזרח ישראלי יכול פינה ל בימש על עבירה ב חול על רקע אנטישמי"
מרב מיכאלי,"יו""ר העבודה העבודה",1,על הרצל וזכויות נשים,"מחזון הרצל למדינת היהודים נעדרת המילה שוויון, ונשים מוזכרות רק בהקשרי הריון ולידה או כדבר שיש 'לתת ולקחת' למען האומה",2021-04-21,"מ חזון הרצל ל מדינה ה יהודי נעדר ה מילה שוויון , ו איש הוזכר רק ב הקשר הריון ו לידה או כ ה דבר ש יש נתן ו לקח למען ה אומה"
בנימין נתניהו,ראש הממשלה הליכוד,5,על הפתרון שלו לפלונטר הפוליטי,"הציבור יחליט מי ירכיב את הממשלה, ולאחר מכן אפשר יהיה להפיל אותה באי-אמון קונסטרוקטיבי. עושים את זה בהרבה מדינות, כולל אירופה",2021-04-20,"ה ציבור החליט מי הרכיב את ה ממשלה , ו לאחר מ כן אפשר היה הפיל את היא ב אי אמון קונסטרוקטיבי . עשה את זה ב הרבה מדינה , כלל אירופה"
אלעזר שטרן,חבר כנסת יש עתיד,4,"על הטיפול של אגף השיקום בנכי צה""ל","כמות נכי צהל הולכת וגדלה עם השנים, למרות שהמלחמות הולכות ופוחתות",2021-04-18,"כמות נכה צהל הלך ו גידל עם ה שנה , למרות ש ה מלחמה הלך ו פחת"
מירב בן-ארי,חברת כנסת יש עתיד,1,על זהות יושבי ראש הכנסת לדורותיהם,עד היום בכל ה-70 שנה הייתה יושבת ראש [כנסת] אחת,2021-04-17,עד ה יום ב כול ה 70 שנה היה יושב ראש כ נס אחת
שרן השכל,חברת כנסת תקווה חדשה,2,על הבקשה שלא תיכנס למליאת הכנסת עם תינוקת,אכן התבקשתי לצאת מהמליאה. בפרוטוקול אסור להכניס תינוקות למליאת הכנסת,2021-04-07,אכן התבקש יצא מ ה מליאה . ב ה פרוטוקול אסור הכניס תינוק ל מליאה הכנסה
אבי דיכטר,חבר כנסת הליכוד,0,"על ביטול מעקב השב""כ אחרי מגעים עם חולי קורונה","לפי משרד הבריאות, איכוני שבכ מנעו 210 מתים ו-30 אלף חולים מקורונה בחודשיים האחרונים",2021-03-29,"לפי משרד ה בריאות , איכון שבכ מנע 210 מתים ו 30 אלף חלה מקורונה ב ה חודש ה אחרון"
יועז הנדל,חבר כנסת תקווה חדשה,5,על ניסיון להטעות את בוחריו ביום הבחירות,הקימו מפלגת קש כדי לגרום לאובדן קולות של תקווה חדשה. נתניהו מפחד רק מהמנדטים של תקווה חדשה [...] הוא ינסה לרמות,2021-03-23,הקים מפלגה קש כדי גרם ל אובדן קול של תקווה חדש . נתניהו פיחד רק מ ה מנדט של תקווה חדש ... הוא ניסה ל רמה
בנימין נתניהו,ראש הממשלה הליכוד,5,על תמיכתו בהתיישבות יהודית מעבר לקו הירוק,"אוכלוסיית יהודה ושומרון הכפילה את עצמה בעשור האחרון. חרף כל הקשיים, היא הכפילה!",2021-03-15,"אוכלוסייה יהודה ו שומרון הכפיל את עצמו ב ה עשור ה אחרון . חרף כול ה קושי , הוא הכפיל !"
יובל שטייניץ,שר האנרגיה הליכוד,3,על טיפולו במשבר הכלכלי ב-2009,"כשנתניהו מינה אותי לאוצר התקרבנו ל-10% אבטלה, והתחזיות היו שכמו ספרד, יוון ואיטליה נגיע גם ל-25%. בפחות משנה הורדנו את האבטלה למינימום לפני כולם",2021-03-10,"כש נתניהו מינה את אני ל ה אוצר התקרב ל 10 אבטלה , ו ה תחזית היה ש כמו ספרד , יוון ו איטליה הגיע גם ל 25 . ב פחות משנה הורד את ה אבטלה ל ה מינימום לפני כולם"
בנימין נתניהו,ראש הממשלה הליכוד,4,על המקום שבו ביקר בסיור בחירות בדרום,ראש הממשלה נתניהו ברהט,2021-03-07,ראש ה ממשלה נתניהו ב רהט
נפתלי בנט,"יו""ר ימינה ימינה",0,על התשלום השנתי למובטלים,אם תהפוך את המס בישראל למאוד נמוך [...] לא נבזבז 18 מיליארד שקל על דמי אבטלה כי לא יהיו כמעט מובטלים,2021-03-07,אם הפך את ה מס ב ישראל ל מאוד נמוך ... לא בזבז 18 מיליארד שקל על דם אבטלה כי לא היה כמעט מובטל
אלי כהן,שר המודיעין הליכוד,3,על פתיחת החקירה בעניין ישראל בבית הדין הפלילי הבינלאומי,בית הדין קובע שגם הבנייה בירושלים היא עבירה,2021-03-06,בית ה דין קבע ש גם ה בנייה ב ירושלים הוא עביר
מיקי זוהר,"יו""ר הקואליציה הליכוד",5,"על פסיקת בג""ץ לגבי גיור רפורמי בישראל","אחרי החלטת בגץ, כל אדם בעולם ייגש לרב רפורמי ויקבל אישור עלייה תוך 30 יום",2021-03-01,"אחרי החלטה בגץ , כול אדם ב ה עולם ניגש ל רב רפורמי ו קיבל אישור עלייה תוך 30 יום"
אביגדור ליברמן,"יו""ר ישראל ביתנו ישראל ביתנו",0,על תעסוקת חרדים,"אם החרדים יעבדו המדינה תרוויח 20 מיליארד שקל בשנה, שבהם אפשר להוסיף 20 בתיח, 2,000 רופאים, להגדיל פי 10 את קצבת הזקנה",2021-02-18,"אם ה חרדי עיבד ה מדינה הרוויח 20 מיליארד שקל ב שנה , ש ב הם אפשר הוסיף 20 בתיח , 2,000 רופא , הגדיל פי 10 את קצבה ה זקנה"
מרב מיכאלי,"יו""ר העבודה העבודה",4,על תוצאות המדיניות הכלכלית של נתניהו,הפערים בין עניים לעשירים בישראל בתקופת נתניהו הם הגבוהים אי פעם. העוני בתקופת נתניהו גדול מבכל תקופה אחרת,2021-02-16,ה פער בין עני ל עשיר בישראל ב תקופה נתניהו הוא ה גבוה אי פעם . ה עוני ב תקופה נתניהו גדול מ בכל תקף אחרת
יפעת שאשא ביטון,"יו""ר ועדת הקורונה תקווה חדשה",0,על טורניר הג'ודו שישראל מארחת,600 אנשים שנכנסים ללא בידוד [...] כשעוד מאוגוסט דרשתי שיהיו בדיקות לכל מי שנכנס לישראל,2021-02-15,600 איש ש נכנס ללא בידוד ... כש עוד מאוגוסט דרש ש יהיה בדיקה ל כול מי ש נכנס ל ה ישראל
יריב לוין,שר התיירות הליכוד,2,על גל ההתפטרויות בכנסת ה-23,"זה דבר שלא היה כדוגמתו: למעלה מ-20 חכים באים והולכים, חלק לא מבוטל נבחרו במפלגות אווירה או עברו אליהן",2021-02-03,"זה דבר ש לא היה כדוגמתו למעלה מ 20 חך בא ו הלך , חלק לא מבוטל נבחר ב מפלגה אווירה או עבר אל"
זאב אלקין,מועמד לכנסת תקווה חדשה,3,על מינוי צמרת הליכוד לתפקידים בכירים בממשלה,"״המשמעות של דמוקרטיה ליכודית נעלמה. זה לא רק גדעון סער, זה כל העשירייה הפותחת. בעבר תמיד מי שזכה בראשות [המפלגה] הציע למפסיד תפקיד בכיר״",2021-02-03,"ה משמעות של דמוקרטיה ל ה יכודית נעלם . זה לא רק גדעון סער , זה כול ה עשירייה ה פתח . ב ה עבר תמיד מי ש זכה ב ראשות ה מפלגה הציע ל ה הפסיד תפקיד בכיר"
נפתלי בנט,"יו""ר ימינה ימינה",4,על ההצדקה לתוכנית הפחתת המס של ימינה,"עד 2003 סינגפור דמתה לישראל בתמג לנפש. מאז רפורמות להפחתת מס, ייעול המגזר הציבורי ופתיחת שווקים, תושביה התעשרו כמעט פי 2 מאיתנו",2021-02-01,"עד 2003 סינגפור דמה ל ה ישראל בתמג ל נפש . מ אז רפורמה ל הפחתה מס , ייעול ה מגזר ה ציבורי ו פתיחה שוק , תושב התעשר כמעט פי 2 מאת אנחנו"
אמיר אוחנה,השר לבטחון פנים הליכוד,3,על הפשיעה בחברה הערבית,20% מהאוכלוסייה מחוללת 60% מהפשיעה,2021-01-30,20 מ ה אוכלוסייה חולל 60 מ ה פשיעה
מרב מיכאלי,"יו""ר העבודה העבודה",2,על השוויון המגדרי ברשימת העבודה,"גבר-אישה-אישה-גבר לסירוגין, כל הרשימה: פעם ראשונה במדינת ישראל",2021-01-29,"גבר איש אייש גבר לסירוגין , כול ה רשימה פיעם ראשונה ב מדינה ישראל"
אביגדור ליברמן,"יו""ר ישראל ביתנו ישראל ביתנו",5,על הנטל הכלכלי של החינוך החרדי,כל הקצבאות הילדים וכל התמיכות בישיבות וקצבאות לאברכים זה 7 מיליארד שקל,2021-01-26,כול ה קצבה ה ילד ו כול ה תמיכה ב ה ישיבה ו קצבה ל אברך זה 7 מיליארד שקל
יואב קיש,סגן שר הבריאות הליכוד,3,על כניסה לישראל ללא בדיקת קורונה,"הבעיה היא דווקא אי-שמירת הבידוד. מעל 50%, אולי 70% מהתחלואה מתגלה בתקופת הבידוד",2021-01-26,"ה בעיה הוא דווקא אי שמירה ה בידוד . מעל 50 , אולי 70 מ ה תחלואה התגלה ב תקופה ה בידוד"
עאידה תומא סלימאן,חברת כנסת הרשימה המשותפת,4,על התמיכה בציבור הערבי בהחרמת ההלוויה של פרס,"בבחירות אחרי הלוויית פרס שוב הייתה ירידה בייצוג המפלגות הציוניות באוכלוסייה הערבית, ועלייה בייצוג הרשימה המשותפת",2021-01-19,"ב ה בחירה אחרי הלוויה פרס שוב היה ירידה ב ייצוג ה מפלגה ה ציוני ב ה אוכלוסייה ה ערבי , ו עלייה ב ייצוג ה רשימה ה משותף"
אביגדור ליברמן,"יו""ר ישראל ביתנו ישראל ביתנו",0,על הצביעות הפוליטית של הליכוד,"כשהגשתי הצח לריבונות בבקעה, נתניהו והליכוד הצביעו נגד עם הרשימה המשותפת",2021-01-18,"כש הגיש הצח ל ה ריבונות ב ה בקעה , נתניהו ו ה ליכוד הצביע נגד עם ה רשימה ה משותף"
יובל שטייניץ,שר האנרגיה הליכוד,2,על התגובות לגילוי מוטציית הקורונה הבריטית,הרבה מדינות אירופיות אמרו גם לאזרחים שלהן: מי שבבריטניה שיישאר כמה שבועות עד שיתבהר המצב,2021-01-18,הרבה מדינה אירופי אמר גם ל ה אזרח של הן מי ש ב בריטניה ש נשאר כמה שבוע עד ש התבהר ה מצב
יובל שטייניץ,שר האנרגיה הליכוד,3,על מבצע החיסון נגד קורונה,מדינת ישראל היא המדינה הראשונה בעולם שכבר הבטיחה לעצמה מנות חיסון לכל אזרחיה,2021-01-13,מדינה ישראל הוא ה מדינה ה ראשון ב ה עולם ש כבר הבטיח ל עצמו מנה חיסון ל כול אזרח
יואב גלנט,שר החינוך הליכוד,5,על הצמיחה בישראל,התוצר לנפש במדינת ישראל עלה פי 2 בעשור האחרון,2021-01-11,ה תוצר ל נפש ב מדינה ישראל עלה פי 2 ב ה עשור ה אחרון
ניצן הורוביץ,"יו""ר מרצ מרצ",5,על הייצוג השוויוני במרצ,אנחנו המפלגה הראשונה בתולדות ישראל שמציבה שני מועמדים ערבים בחמישייה הראשונה,2021-01-07,הוא ה מפלגה ה ראשון ב תולדה ישראל ש הציב שניים מועמד ערבי ב ה חמישייה ה ראשון
הליכוד,מפלגה,4,על התוכנית לפיתוח כלכלי בחברה הערבית,נתניהו הביא 15 מיליארד שקל למגזר הערבי - פי 100 יותר מכל ראש ממשלה קודם בישראל,2021-01-04,נתניהו הביא 15 מיליארד שקל ל ה מגזר ה ערבי פי 100 יותר מ כול ראש מ משל היא קודם ב ה ישראל
מנסור עבאס,"יו""ר רע""מ הרשימה המשותפת",2,על דפוסי ההצבעה של הציבור הערבי,"נָתַנּוּ לברק 98% מהקולות שלנו לראשות הממשלה, הפנה אלינו עורף - ואתה יודע מה קיבלנו",2021-01-03,"נ ת נ ו ל ברק 98 מ ה קול ש לן ל ראשות ה ממשלה , הפנה אל אנחנו עורף ו הוא ידע מה קיבל"
ירון זליכה,"יו""ר המפלגה ""הכלכלית""",0,על הישגיו כחשב הכללי באוצר,התקופה שאני כיהנתי באוצר הייתה תקופת הצמיחה הכי ארוכה והכי חזקה בישראל,2021-01-02,ה תקופה ש הוא כיהן ב ה אוצר היה תקופה ה צמיחה הכי ארוך ו הכי חיזק ב ה ישראל
איילת שקד,חברת כנסת ימינה,2,על הצניחה בתוצר בגלל הקורונה,"לראשונה בהיסטוריה התוצר של ישראל יורד. לא [כשהיתה] אינפלציה, לא במלחמת יום כיפור - היום!",2020-12-31,"לראשונה ב ה היסטוריה ה תוצר של ישראל הורד . לא כש היה אינפלציה , לא ב מלחמה יום כיפור ה יום !"
אלי אבידר,חבר כנסת ישראל ביתנו,4,על הישגי נתניהו בבחירות האחרונות,בשלוש מערכות הבחירות האחרונות נתניהו כל פעם יורד. המצב הכי טוב שלו היה בסבב הראשון,2020-12-23,ב שלוש מערכה ה בחירה ה אחרון נתניהו כול פעם יורד . ה מצב הכי טוב של הוא היה ב ה סבב ה ראשון
אמיר אוחנה,השר לבטחון פנים הליכוד,2,על השפעת נתניהו על מערכת המשפט,"העליון קבע שזה תקין שרמ עם כתב אישום יקבע מי יהיה שר המשפטים, ומי יקבע מי יהיו השופטים",2020-12-19,"ה עליון קבע ש זה תקין שרמ עם כתב אישום קיבע מי היה שר ה משפט , ו מי קיבע מי היה ה שופט"
איציק שמולי,שר העבודה והרווחה העבודה,3,על הישגיו במשרד הרווחה,"בזמן שאין תקציב הכפלתי את מספר המפקחים [במעונות] פי שישה. היו רק 20, היום יש 120",2020-12-17,"ב ה זמן ש אין תקציב ה כפל את מספר ה מפקח ב מעון פה שישה . היה רק 20 , ה יום יש 120"
צחי הנגבי,השר לענייני התיישבות הליכוד,5,על הסיוע הממשלתי במגפת הקורונה,כ-150 מיליארד שקל הופנו למענקים לבעלי עסקים. זה מה שהמדינה הקצתה,2020-12-17,כ 150 מיליארד שקל הופנה ל ה מענק ל בעל עסק . זה מה ש ה מדינה ה קצת
יוליה מלינובסקי,חברת כנסת ישראל ביתנו,3,על לימודי הליבה של תלמידים חרדים,"הילדים החרדים פשוט לוקחים מהם עתיד. הם לא לומדים לימודי ליבה לא מתמטיקה, לא אנגלית",2020-12-16,"ה ילד ה חרד פשוט לקח מ הוא עתיד . הוא לא למד לימוד ליבה לא מתמטיקה , לא אנגלי"
מירי רגב,שרת התחבורה הליכוד,5,על ההכנות לחיסון מפני קורונה,"גרמניה - אין לה את החיסונים! ראש הממשלה הימר נכון, והביא את החיסונים",2020-12-12,"גרמני אין ל היא את ה חיסון ! ראש ה ממשלה הימר נכון , ו הביא את ה חיסון"
אביגדור ליברמן,"יו""ר ישראל ביתנו ישראל ביתנו",4,על התמותה מקורונה בישראל,תשווה כמה מתים למיליון איש בקפריסין וכמה אצלנו. אצלנו דומני פי 40,2020-12-06,שיווה כמה מת ל מיליון איש ב קפריסין ו כמה אצל אנחנו . אצל אנחנו נדמה פי 40
יאיר לפיד,"ראש האופוזיציה יש עתיד-תל""ם",5,על הכוח האלקטורלי שלו ושל בני גנץ,"במערכת הבחירות הראשונה והשנייה שנינו היינו על הפתק כמועמדים משותפים, והיה 35 מנדטים. דווקא הירידה הייתה כשירדתי מהפתק",2020-12-05,"ב מערכה ה בחירה ה ראשון ו ה שנייה ש נין היה על ה פתק כ מועמד משותף , ו היה 35 מנדט . דווקא ה ירידה היה כש ירד מ ה פתק"
רם שפע,חבר כנסת כחול לבן,4,על כללי אישור תקציב המדינה,נסביר: ממשלה אמורה כל שנה לסגור מראש את התקציב. מה שהיינו אמורים לסגור בתחילת 21' זה תקציב 22',2020-12-02,הסביר ממשלה אמור כול שנה סגר מראש את ה תקציב . מה ש היה אמור סגר ב תחילה 21 זה הקציב 22
קטי שטרית,חברת כנסת הליכוד,4,על החלטות ועדת השרים לחקיקה,"הגשתי 19 הצעות חוק - אחת לא עברה. אבל כשהאופוזיציה מגישה, מיד זה עולה",2020-12-01,"הגיש 19 הצעה חוק אחת לא עיבר . אבל כש ה אופוזיציה הגיש , מייד זה עלה"
יאיר לפיד,"ראש האופוזיציה יש עתיד-תל""ם",4,על סגירת בתי הספר בשל הקורונה,אנחנו המדינה היחידה - אנחנו ובנגלדש - [שבה] ממרץ ילדים לא היו בבית ספר,2020-11-30,הוא ה מדינה ה יחיד הוא ו בנגלדש ש ב היא מ מרץ ילד לא היה ב בית ספר
אביגדור ליברמן,"יו""ר ישראל ביתנו ישראל ביתנו",5,על נסיעת נתניהו לערב הסעודית,רהמ נוסע לערב הסעודית ולא מעדכן - בניגוד לחוק שקובע שכשהוא עוזב את ישראל הוא ימנה ממ. כשהוא הלך לניתוחון בישראל מינו ממ,2020-11-26,רהמ נסע ל ה ערב ה סעודי ו לא עדכן בניגוד ל ה חוק ש קובע ש כש הוא עזב את ישראל הוא מינה ממ . כש הוא הילך ל ניתוחון ב ישראל מינה ממ
מירי רגב,שרת התחבורה הליכוד,5,על הגדרת סעודיה ובחריין כמדינות ירוקות לקורונה,"מי שקובע מי המדינות הירוקות זה לא אנחנו, אלא הארגון הרפואי הבינלאומי",2020-11-24,"מי ש קובע מים ה מדינה ה ירוק זה לא הוא , אלא ה ארגון ה רפואי ה בינלאומי"
עמיר פרץ,שר הכלכלה העבודה,4,על מצב העבודה בסקרי הבחירות,"העבודה הייתה גם הייתה בשפל כזה.
אחרי שברק... היא לא עברה בסקרים את אחוז החסימה",2020-11-23,"העבודה הייתה גם הייתה בשפל כזה.
אחרי שברק... היא לא עברה בסקרים את אחוז החסימה"
יולי אדלשטיין,שר הבריאות הליכוד,5,על חוק שיחייב התחסנות מפני קורונה,למיטב ידיעתי אין אף מדינה דמוקרטית שבה יש חוק חיסון חובה,2020-11-22,ל מיטב ידיעה אין אף מדינה דמוקרטי ש ב היא יש חוק חיסון חובה
יפעת שאשא ביטון,"יו""ר ועדת הקורונה תקווה חדשה",5,על הקריטריונים להקלת הגבלות הקורונה,"כשהתחילו לצאת מהסגר השני יצרו את מקדם ההדבקה, הכוכב החדש בשיח שהוא מקדם הפחדה להכשרת המגבלות הבאות",2020-11-19,"כש התחייל יצא מ ה סגר ה שני יצר את מקדם ה הדבקה , ה כוכב ה חדש ב ה שיח ש הוא קידם הפחדה ל הכשרה ה מגבלה ה בא"
"ישראל כ""ץ",שר האוצר הליכוד,3,על ביטול המכס ביבוא חמאה,"הביקוש [לחמאה] גדל, אבל לא רק מהיבוא. גם התוצרת המקומית נמכרה יותר מאשר קודם",2020-11-18,"ה ביקוש ל חמאה גדל , אבל לא רק מ ה ייבוא . גם ה תוצרת ה מקומי נמכר יותר מאשר קודם"
