person,job,label,theme,text,date,lemmatized_text
יריב לוין,שר התיירות הליכוד,5,"על השפעת פסיקות בג""ץ על קצב יציאת מהגרים ומבקשי מקלט מהארץ","עד שבוטל החוק הראשון [...] קצב היציאה הגיע ללמעלה מ-1,500 מסתננים שיצאו מכאן בחודש, והקצב הלך וגדל כל הזמן. מהרגע שבוטל החוק על ידי בגץ, באופן מיידי היתה צניחה עד קרוב לאפס במספר היוצאים",2018-10-12,"עד ש בוטל ה חוק ה ראשון ... קצב ה יציאה הגיע ל למעלה מ 1,500 הסתנן ש יצא מ כאן ב ה חודש , ו ה קצב הילך ו גידל כול ה זמן . מ ה רגע ש בוטל ה חוק על יד בגץ , ב אופן מיידי היה צניחה עד קרוב ל ה אפס ב מספר ה יוצא"
אליאב בן שמעון,"מנכ""ל התאחדות בוני הארץ",5,על העלייה במספר ההרוגים בתאונות בנייה,"הנתונים לא השתנו בשנים האחרונות, מה שכן השתנה זה היקפי הבנייה בישראל שגדלו פי 2, מספר אתרי הבנייה שגדלו פי 2",2018-10-11,"ה נתון לא השתנה ב ה שנה ה אחרון , מה שכן השתנה זה היקף ה בנייה ב ישראל ש גדל פי 2 , מספר אתר ה בנייה ש גדל פי 2"
דני דנון,"שגריר ישראל באו""ם",4,"בעקבות התפטרותה של שגרירת ארה""ב באו""ם","אנחנו נמצאים במומנטום מאוד חזק של נצחונות, העברנו החלטה בעצרת הכללית של גינוי החמאס",2018-10-10,"הוא נמצא ב ה מומנטום מאוד חזק של ניצחון , העביר החלטה ב ה עצרת ה כללי של גינוי ה חמאס"
אסף הראל,מועמד לראשות עיריית תל אביב-יפו,5,על מיזם שיתוף המכוניות 'אוטותל',"יש לזה כולה 1,000 משתמשים קבועים",2018-10-07,"יש ל ה זה כול 1,000 משתמש קבוע"
רון חולדאי,ראש עיריית תל אביב-יפו,1,על סמכויות עיריית תל אביב בנושא תחבורה ציבורית,תחבורה ציבורית במדינת ישראל [...] היא אך ורק בסמכותו של משרד התחבורה,2018-10-04,תחבורה ציבורי ב מדינה ישראל ... הוא אך ו רק ב סמכות של משרד ה תחבורה
"ישראל כ""ץ",שר האוצר הליכוד,5,על מעורבותו של רון חולדאי בהקמת גשר יהודית בתל אביב,"אפילו את הגשר הזה הוא [רון חולדאי] לא דחף, שפתאום הוא דוחף אותו לפני הבחירות",2018-10-04,"אפילו את ה גשר ה זה הוא רון חולדאי לא דחף , ש פתאום הוא דחף את הוא לפני ה בחירה"
יאיר לפיד,"יו""ר יש עתיד יש עתיד-תל""ם",4,"על הגדרת אונר""א לפליטים הפלסטינים","היום אדם יכול להיוולד בוילה בפריז או בקטאר, ולקבל בבוקר שבו הוא נולד תעודת תושב או תעודת אזרח צרפתי, אבל הוא גם פליט פלסטיני",2018-10-03,"היום אדם יכול נולד ב ה וילה ב פריז או ב ה קטאר , ו קיבל ב ה בוקר ש ב הוא הוא נולד תעודה תושב או תעודה אזרח צרפתי , אבל הוא גם פליט פלסטיני"
תמר זנדברג,חברת כנסת המחנה הדמוקרטי,4,על ההשקעה הכספית לילד בחינוך בישראל,השבוע פורסם שההשקעה לילד בחינוך בישראל היא הנמוכה ביותר ב-OECD,2018-10-03,השבוע פורסם ש ה השקעה יילד ב ה חינוך ב ישראל הוא ה נמוך ביותר ב
יאיר לפיד,"יו""ר יש עתיד יש עתיד-תל""ם",5,"על תגובת סבא""א לנאום נתניהו באו""ם","העובדה שסבאא שולחים אנשים לבדוק את המידע שהוא הביא באום רק שלושה ימים אחרי, זאת דוגמה לחורים בפיקוח שלהם [...] היו להם [לאירן] שלושה ימים לפנות את מה שהיה שם, ואז הזמינו את העיתונאים ואת סבאא",2018-10-03,"ה עובדה שסבאא שלח איש בדק את ה מידע ש הוא הביא ב ה אום רק שלושה ים אחרי , זאת דוגמה ל ה חור ב ה פיקוח של הם ... היה ל ה הוא אייר שלושה ים פינה את מה ש היה שם , ו אז הזמין את ה עיתונאי ו את סבאא"
מייקל אורן,סגן שר במשרד רה״מ כולנו,3,"על נאום טראמפ בעצרת הכללית של האו""ם","הוא חוזר למה שהיה בארהב לפני 100 פלוס שנה, כשארהב התנגדה להקמתו של חבר הלאומים, בראשית המאה העשרים. [הם] לא הצטרפו, בגלל שהאמריקאים שונאים את הגלובליזם",2018-09-26,"הוא חזר ל מה ש היה ב ארה""ב לפני 100 פלוס שנה , כש ארה""ב התנגד ל הקמה של חבר ה לאום , ב ראשית ה מאה ה עשרים . הוא לא הצטרף , בגלל ש ה אמריקני שנא את ה גלובליזם"
יהודה גליק,חבר כנסת הליכוד,5,על האוכלוסייה היהודית והפלסטינית מעבר לקו הירוק,"יש פה היום כשני מיליון פלסטינים פלוס מינוס. חיים פה, מעבר לקו הירוק, כמעט מיליון יהודים, כולל מזרח ירושלים",2018-09-14,"יש פה היום כ שני מיליון פלסטיני פלוס מ נס . חי פה , מעבר ל ה קו ה ירוק , כמעט מיליון יהודי , כלל מזרח ירושלים"
יאיר לפיד,"יו""ר יש עתיד יש עתיד-תל""ם",5,על השכר הריאלי במשק,"אתם יודעים מה זה שחיקת השכר הריאלי? זה שאתה מרוויח אותו דבר, אבל ההוצאות שלך גדלות כי הכל עולה יותר. סטטיסטית, זה המצב של רוב אזרחי מדינת ישראל. מרוויחים אותו דבר, מוציאים הרבה יותר",2018-09-13,"הוא ידע מה זה שחיקה ה שכר ה ריאלי ? זה ש הוא הרוויח את הוא דבר , אבל ה הוצאה ש ל אתה גדל כי ה כול עלה יותר . סטטיסטית , זה ה מצב של רוב אזרח מדינה ישראל . הרוויח את הוא דבר , הוציא הרבה יותר"
אלי אלאלוף,"יו""ר ועדת העבודה, הרווחה והבריאות כולנו",4,על העלייה במספר ההרוגים בתאונות בניין,הבעיה היא שכמות אתרי הבניה הלכה וגדלה [...] אז אל תשתמשו בסטטיסטיקה כבסיס לכל הידע בנושא הזה,2018-09-12,ה בעיה הוא ש כמות אתר ה בנייה הילך ו גידל ... אז אל השתמש ב סטטיסטיקה כ בסיס ל כול ה ידע ב ה נושא ה זה
תמר זנדברג,חברת כנסת המחנה הדמוקרטי,3,על עמדות סיעות הכנסת ביחס לפתרון שתי המדינות,"המפלגות שמתנגדות לפתרון שתי המדינות הן בוודאות מיעוט. הכנסת מתחלקת בין מפלגות שתומכות, לבין מפלגות שהן אדישות לרעיון, והולכות עם איזו ממשלה שלא תבוא",2018-09-12,"ה מפלגה ש התנגד ל פתרון שתיים ה מדינה הן ב ודאות מיעוט . הכנסה התחלק בין מפלגה שתומכות , לבין מפלגה ש הוא אדיש ל ה רעיון , ו הלך עם איזה ממשלה ש לא בא"
"ישראל כ""ץ",שר האוצר הליכוד,1,בעקבות ההודעה על סגירת הנציגות הפלסטינית בוושינגטון,"״פנייה לבית הדין הבינלאומי בהאג [היא] בניגוד לכל הסכם שהם חתומים עליו, בניגוד לחוק האמריקאי״",2018-09-12,"פנייה ל בית ה דין ה בינלאומי ב האג הוא בניגוד ל כול ה סכם ש הוא חתם על הוא , ב ניגוד ל ה חוק ה אמריקני"
מאיר כהן,חבר כנסת יש עתיד - כחול לבן,5,על גובה השכר בישראל,עדיין רוב האנשים במדינת ישראל משתכרים שכר מינימום ופחות,2018-09-07,עדיין רוב ה איש ב מדינה ישראל השתכר שכר מינימום ו פחות
אורי אריאל,שר החקלאות הבית היהודי,5,"על האחריות לאכיפת חוק צער בעלי חיים, בעקבות הביקורת על מנהג הכפרות",האכיפה בתוך הערים היא באחריות הרשויות. בתל-אביב זה עיריית תל-אביב וכן הלאה. זה לא באחריות משרד החקלאות,2018-09-04,ה אכיפה בתוך ה עיר הוא ב אחריות ה רשות . ב תל אביב זה עירייה תל אביב ו כן הלאה . זה לא ב אחריות משרד ה חקלאות
שלי יחימוביץ',חברת כנסת העבודה,4,על מס ירושה,ישראל היא אחת המדינות הבודדות בעולם שאין בה מס ירושה,2018-09-04,ישראל הוא אחת ה מדינה ה בודד ב ה עולם ש אין ב היא מס ירושה
יאיר לפיד,"יו""ר מפלגת יש עתיד יש עתיד-תל""ם",4,על השינוי במחירי המזון והדיור בתקופת כהונתה של הממשלה הנוכחית,"מאז הקמתה של הממשלה הזאת, מחירי הדירות עלו ב-13%, מחירי המזון עלו ב-8%",2018-09-03,"מ אז הקמה של ה ממשלה ה זאת , מחיר ה דירה עלה ב 13 , מחיר ה מזון עלה ב 8"
זאב אלקין,מועמד לכנסת תקווה חדשה,3,"על החלטות אונסק""ו בעניין חברון וירושלים","לפני כשנה, אונסקו הכריזה על חברון כאתר מורשת פלסטיני, תוך התעלמות מוחלטת מההיסטוריה היהודית בחברון, וגם שורה של החלטות אחרות כמו ההחלטה שמוחקת את האופי היהודי של ירושלים [...] כל השיח על הר הבית כאתר מורשת מוסלמי בלבד",2018-09-03,"לפני כ שנה , אונסק""ו הכריז על חברון כ אתר מורשת פלסטיני , תוך התעלמות מוחלט מ ה היסטוריה ה יהודי ב חברון , ו גם שורה של החלטה אחר כמו ה החלטה ש מחק את ה אופי ה יהודי של ירושלים ... כול ה שיח על הר ה בית כ אתר מורש מוסלמי בלבד"
"שי באב""ד","מנכ""ל משרד האוצר",5,על השביתה במעונות היום,״זה רק 20% מהארגונים היום ששובתים. רוב הארגונים שקיימים באותם תנאים [...] לא עשו את אותה סיטואציה.,2018-09-02,זה רק 20 מ ה ארגון ה יום ש שבת . רוב ה ארגון ש קיים ב אותו תנאי ... לא עשה את את היא סיטואציה .
אבי דיכטר,חבר כנסת הליכוד,1,"על אונר""א","יש ארגון של האום שמטפל ב-60 מיליון פליטים בעולם, UNHCR. הוא מעסיק 10,000 פקידים. אונרא, שמטפל בכחמישה מיליון פליטים פלסטינים, מעסיק 30,000 פקידים",2018-09-02,"יש ארגון של ה אום ש טיפל ב 60 מיליון פליט ב ה עולם , . הוא העסיק 10,000 פקיד . אונרא , ש טיפל בכחמישה מיליון פליט פלסטיני , העסיק 30,000 פקיד"
רועי פולקמן,"יו""ר סיעת כולנו כולנו",2,על השינוי במחיר דג האמנון הקפוא במהלך כהונתו של כחלון,"האמנון הקפוא עלה כמעט 40 שקל לקילו, היום אנחנו ב-33-32",2018-08-27,"ה אמנון ה קפוא עלה כמעט 40 שקל ל ה קילוגרם , היום הוא ב 33 32"
רועי פולקמן,"יו""ר סיעת כולנו כולנו",0,על שיעור האבטלה במשק,"אנחנו באבטלה שלא הייתה נמוכה כמוה משנות ה-70. בסוף הקדנציה של שר האוצר הקודם האבטלה עמדה על כמעט שישה אחוזים, 5.9",2018-08-27,"הוא ב ה אבטלה ש לא היה נמוך כמו היא מ שנה ה 70 . ב סוף ה קדנציה של שר ה אוצר ה קודם ה אבטלה עימד על כמעט שישה אחוז , 5.9"
אלי בן-דהן,סגן שר הביטחון הבית היהודי,5,"על הגדרת האו""ם לפליטים",בזמן שהוקמה אונרא הוקמה גם רשות לשיקום פליטים אחרים בעולם. לכל היותר אדם נחשב פליט שבע שנים,2018-08-26,ב ה זמן ש הוקם אונרא הוקם גם רשות ל שיקום פליט אחר ב ה עולם . ל כול ה יותר אדם נחשב פליט שבע שנה
אמיר אוחנה,השר לבטחון פנים הליכוד,4,על השימוש בנשק חם ברישיון במקרי רצח במשפחה,"כשאנחנו בודקים את הנתונים בשני העשורים האחרונים אנחנו מוצאים ש-2% בערך בוצעו על ידי כלי נשק פרטיים [...] 98% מהמקרים האחרים של רצח בתוך המשפחה אירעו בסכין, גרזן, פטיש, חניקה",2018-08-22,"כש הוא בדק את ה נתון ב שני ה עשור ה אחרון הוא מצא ש 2 ב ה ערך בוצע על יד כלי נשק פרטי ... 98 מ ה מקר ה אחר של רצח בתוך ה משפחה אירע ב סכין , גרזן , פטיש , חניקה"
יצחק כהן,סגן שר האוצר ש”ס,5,על הצורך לקיים עבודות לבניית גשר יהודית בתל אביב בשבת,"כל הסיפור הזה הוא גימיק, הוא פרובוקציה. הוא התחיל כצורך פוליטי לקראת הבחירות המקומיות המוניציפליות. אף אחד לא באמת חושב שתוכנית כזאת גדולה יצאה פתאום בין לילה",2018-08-22,"כול ה סיפור ה זה הוא גימיק , הוא פרובוקציה . הוא התחיל כ צורך פוליטי לקראת ה בחירה ה מקומי ה מוניציפליות . אף אחד לא באמת חשב ש תוכנית כ ה זאת גדול ייצא פתאום בין לילה"
אלי כהן,שר הכלכלה הליכוד,4,על ירידת מדד מחירי המזון,במהלך השנתיים האחרונות גם המחירים ירדו ב-5.5% אחרי עשור של עלייה,2018-08-20,ב מהלך ה שנה ה אחרון גם ה מחיר ירד ב 5.5 אחרי עשור של עלייה
אורן חזן,חבר כנסת הליכוד,5,על רצועת עזה,"בעזה לא חיים מקומיים, ילידים, בעזה יש מהגרים – מישראל, ממצרים, מסוריה, מלבנון – החמאסניקים הם לא אנשי האדמה, הם לא נולדו שם. מרביתם, מעל שני שליש מהם, הגיעו מכל מיני מקומות, לכן אין להם חיבור",2018-08-19,"ב עז לא חי מקומי , יליד , ב עז יש מהגר מ ישראל , מ מצר , מסור , מ לבנון ה חמאסניקים הוא לא איש ה אדמה , הוא לא נולד שם . מ רבייה , מעל שני שליש מ הוא , הגיע מ כול מין מקום , לכן אין ל הם חיבור"
אורן חזן,חבר כנסת הליכוד,3,על ההכנסות הצפויות לתאגיד השידור מאירוח האירוויזיון,"בסוף כשנשדר את האירוויזיון - מוכרים זכויות שידור, יש הכנסות מחסויות, יש הכנסות מפרסומות, יש הכנסות מכרטיסים, יש הכנסות ממרצ'נדייז מסביב",2018-08-14,"ב סוף כש שידר את ה אירוויזיון מכר זכות שידור , יש הכנסה מ חסות , יש הכנסה מ פרסומת , יש הכנסה מ כרטיס , יש הכנסה מ מרצ נדייז מ סביב"
מירי רגב,שרת התחבורה הליכוד,5,על גוש עציון,"השטח הזה רווי באתרים יהודיים. כאן, כמה שתחפרו לא תמצאו מטבע פלסטיני אחד. מה לעשות? רק עתיקות והיסטוריה של העם היהודי מלפני 3,000 ו-4,000 שנה",2018-08-14,"ה שטח ה זה רווי ב אתר יהודי . כאן , כמה שתחפרו לא מצא מ טבע פלסטיני אחד . מה עשה ? רק עתיקה ו היסטוריה של ה עם ה יהודי מ לפני 3,000 ו 4,000 שנה"
מיקי זוהר,"יו""ר ועדת הכנסת הליכוד",4,על כהונת ראשי תאגיד השידור,ראשי התאגיד - ואנחנו נצטרך לעשות שינוי חקיקתי בעניין הזה - תפקידם מובטח לשנים ארוכות בלי שלממשלה יש שום השפעה על העניין הזה,2018-08-14,ראש ה תאגיד ו הוא הצטרך עשה שינוי חקיקה ב ה עניין ה זה תפקיד הובטח ל שנה ארוך בלי ש ל ה ממשלה יש שום ה שפעה על ה עניין ה זה
מיקי זוהר,"יו""ר ועדת הכנסת הליכוד",5,על הערכת תאגיד השידור לגבי העלות הכוללת של האירוויזיון,מי קבע שהאירוויזיון יעלה 150 מיליון שקל? לא עשו אירוויזיונים ב-40-30 מיליון שקל?,2018-08-14,מי קבע ש ה אירוויזיון ייעל 150 מיליון שקל ? לא עשה אירוויזיונים ב 40 30 מיליון שקל ?
בצלאל סמוטריץ׳,"סגן יו""ר הכנסת ימינה",5,על השליטה הישראלית בעזה,"קודם כל לא היה ממשל צבאי [ברצועת עזה], אני רוצה לחזור למה שהיה בראשית שנות התשעים, לפני האיוולת הגדולה של הסכמי אוסלו",2018-08-14,"קודם כול לא היה ממשל צבאי ב רצועה עז , הוא רצה חזר ל מה ש היה ב ראשית שנה ה תשעים , לפני ה איוולת ה גדול של הסכם אוסלו"
איוב קרא,שר התקשורת הליכוד,5,על המחאה נגד חוק הלאום,"אני חוקקתי את חוק הדגל וההמנון, ואנשים לא יודעים",2018-08-13,"הוא חוקק את חוק ה דגל ו ה המנון , ו איש לא ידע"
איוב קרא,שר התקשורת הליכוד,5,על תאגיד השידור הישראלי,"יש להם קרוב למיליארד שקל, מבחינה פרופורציונית זה התאגיד הכי מתוקצב במערב",2018-08-13,"יש ל ה הוא קרוב ל מיליארד שקל , מ בחינה פרופורציונית זה ה תאגיד הכי תוקצב ב ה מערב"
אלי כהן,שר הכלכלה הליכוד,5,על העלאת דירוג האשראי של ישראל,יש רק 11 מדינות בעולם שנמצאות מעל מדינת ישראל,2018-08-09,יש רק 11 מדינה ב ה עולם ש נמצא מעל מדינה ישראל
מיכאל מלכיאלי,"חבר כנסת ש""ס",4,על הסמכות לאכוף חוקים עירוניים שאוסרים פתיחת עסקים בשבת,"שר הפנים אין בסמכותו לאכוף את החוק, זה רק הרשות המקומית. ירצה ביבס [ראש עיריית מודיעין] יאכוף, לא ירצה לא יאכוף",2018-08-06,"שר ה פני אין ב סמכות אכף את ה חוק , זה רק ה רשות ה מקומי . ריצה ב יבס ראש עירייה מודיעין אכף , לא ריצה לא אכף"
עבד אל-חכים חאג' יחיא,חבר כנסת הרשימה המשותפת,1,על היעדר נגישות לדיור לאוכלוסייה הערבית,"למרות שאנחנו יותר מ-50% מתחת לקו העוני, [יש] אפס דירות ציבוריות ביישובים הערביים",2018-08-05,"למרות ש הוא יותר מ 50 מתחת ל קו ה עוני , יש אפס דירה ציבורי ב ה יישוב ה ערבי"
מוסי רז,חבר כנסת מרצ,5,על קליטה של סייענים פלסטינים לתחומי ישראל,"״ממשלת ישראל הזו, של הימין, קיבלה תוך עשור כ-120 אלף משת״פים ובני משפחותיהם״",2018-08-05,"ממשלה ישראל ה זו , של ה ימין , קיבל תוך עשור כ 120 אלף מ שת פים ו בן משפחה"
אורן חזן,חבר כנסת הליכוד,5,על התפלגות ההצבעה בתל אביב-יפו בבחירות לכנסת,"תל אביב היא לא עיר של שמאל בכלל, בבחירות האחרונות 50% מתושבי העיר הצביעו למפלגות ימין",2018-08-03,"תל אביב הוא לא עיר של שמאל בכלל , ב בחירה ה אחרון 50 מ תושב ה עיר הצביע ל מפלגה ימין"
ענת ברקו,חברת כנסת הליכוד,4,על מעמד השפה הערבית בישראל,"השפה הערבית לא היתה מעולם שפה רשמית במדינת ישראל [...] גם היום כשמישהו מתדיין בבית משפט הוא לא יכול להגיש את כל החומרים שלו בערבית, גם לא בבגץ",2018-08-02,"ה שפה ה ערבי לא היה מעולם שפה רשמי ב מדינה ישראל ... גם ה יום כש מישהו התדיין ב בית משפט הוא לא יכול הגיש את כול ה חומר של הוא ב ערבית , גם לא ב ה בגץ"
אופיר אקוניס,שר המדע והטכנולוגיה הליכוד,5,על סירובו לאשר את מינויה של מדענית לוועדה מקצועית,"מינויה של הפרופ' יעל אמיתי לא אושר בשל עמדותיה, אלא בשל תמיכתה בסרבנות לשירות בצהל, דבר שמהווה עבירה על החוק!",2018-08-01,"מינוי של ה פרופ ייעל אמיתי לא אושר בשל עמדה , אלא בשל תמיכה ב סרבנות ל שירות בצהל , דבר ש היווה עביר על ה חוק !"
דב חנין,חבר כנסת הרשימה המשותפת,4,"על הסעיף שבוטל בחוק הלאום, שנועד לאפשר הקמת יישובים נפרדים","הסעיף הזה הוא העתקה של חוק האזורים הנפרדים שחוקק בדרום אפריקה ב-1950, שאמר שכל קהילה יכולה לחיות בנפרד. הוא לא דיבר על העדפה לאף אחד [...] החוק עורר כל כך הרבה ביקורת שביהמש של האפרטהייד ביטל אותו ב-1957",2018-07-30,"ה סעיף ה זה הוא העתקה של חוק ה אזור ה נפרד ש חוקק ב דרום אפריקה ב 1950 , ש אמר ש כול קהילה יכול חי בנפרד . הוא לא דיבר על העדפה ל ה אף אחד ... ה חוק עורר כול כך הרבה ביקורת ש ב ה יהמש של ה אפרטהייד ביטל את הוא ב 1957"
שולי מועלם-רפאלי,"יו""ר סיעה הבית היהודי",4,על חוק הלאום,"מראיין: מדוע שלא תופיע שם גם המילה 'שוויון'?
מועלם-רפאלי: כיוון שהמילה שוויון מופיעה כבר בשני חוקי יסוד שחוקקו פה ב-1992",2018-07-29,"מראיין: מדוע שלא תופיע שם גם המילה 'שוויון'?
מועלם-רפאלי: כיוון שהמילה שוויון מופיעה כבר בשני חוקי יסוד שחוקקו פה ב-1992"
מירי רגב,שרת התרבות והספורט הליכוד,5,על סרט הפתיחה של פסטיבל הקולנוע בירושלים,"'הבלתי רשמיים' - הסרט על הקמת מפלגת שס יהיה הסרט הישראלי הראשון, שיפתח את פסטיבל הקולנוע בירושלים",2018-07-26,"ה בלתי רשמי ה סרט על הקמה מפלגה שס היה ה סרט ה ישראלי ה ראשון , ש נפתח את פסטיבל ה קולנוע ב ה ירושלים"
זאב אלקין,"השר להגנת הסביבה, לירושלים ולמורשת תקווה חדשה",4,"על חוק הפונדקאות, שמונע מהומוסקסואלים גישה לפונדקאות","שנתיים שיאיר לפיד היה שר בכיר ולא ישבו בממשלה מפלגות חרדיות, למה אז לא חוקקו את זה?",2018-07-25,"שנה שיאיר לפיד היה שר בכיר ו לא נשבה ב ה ממשלה מפלגה חרדי , למה אז לא חוקק את זה ?"
בנימין נתניהו,ראש הממשלה הליכוד,5,על היחס לנוצרים במזרח התיכון,"ישראל היא המדינה היחידה, בטווח של אלפי מיילים, שבה הנוצרים לא רק שורדים, אלא משגשגים",2018-07-23,"ישראל הוא ה מדינה ה יחיד , ב טווח של אלף מייל , ש ב היא ה נוצרי לא רק שרד , אלא שגשג"
