person,job,label,theme,text,date,lemmatized_text
אורן חזן,חבר כנסת הליכוד,5,"על יו""ר הכנסת יולי אדלשטיין, שמתח ביקורת על נתניהו","הוא ישב בכלא על סחר בסמים. הוא טוען שטפלו לו את זה, ותפרו לו תיק, אבל צריך לומר את האמת [...] זה לא אני אומר את זה, אגב, זה הוויקיפדיה שלו אומרת",2018-01-29,"הוא ישב ב ה כלא על סחר ב סם . הוא טען ש טפל ל הוא את זה , ו תפר ל הוא תיק , אבל צריך אמר את ה אמת ... זה לא הוא אמר את זה , אגב , זה ה וויקיפדיה של הוא אמר"
איילת שקד,חברת כנסת ימינה,5,על אריתראים וסודנים שהגיעו לישראל דרך מצרים,"ברגע שאתה עובר דרך עוד מדינה אתה כבר לא נחשב פליטים. הם יכולים אולי להיחשב פליטים במצרים אבל לא בישראל, על פי אמנת האום",2018-01-24,"ב ה רגע ש הוא עבר דרך עוד מדינה הוא כבר לא נחשב פליט . הוא יכול אולי נחשב פליט ב מצרי אבל לא בישראל , על פה אמנה ה אום"
נפתלי בנט,"יו""ר ימינה ימינה",4,על מבקשי מקלט ומהגרי עבודה מסודן ומאריתראה השוהים בישראל,"מדובר בעיקר בגברים צעירים בגיל עבודה. יש יחס של 1:5 בין גברים לנשים. כמעט ואין זקנים או ילדים. אלו סימנים מובהקים להסתננות לצרכי עבודה, לעומת פליטות ובריחה מסכנת חיים",2018-01-24,"דובר בעיקר ב גבר צעיר ב גיל עבודה . יש יחס של 1 5 בין גבר ל ה איש . כמעט ו אין זקן או ילד . אלו סימן הובהק ל הסתננות ל צורך עבודה , לעומת פליטה ו בריחה מ סכנה חיים"
איילת שקד,חברת כנסת ימינה,5,על מדיניות הממשלה בעניין מבקשי מקלט,"הפליטים מביניהם שהגיעו מאזורי סכסוך, בעיקר מדרפור, זוכים בישראל להגנה ולמעמד של פליט",2018-01-24,"ה פליט מבין הם ש הגיע מ אזור סכסוך , בעיקר מ דרפור , זכה ב ישראל ל ה הגנה ו ל ה מעמד של פליט"
נפתלי בנט,"יו""ר ימינה ימינה",5,על בחינת בקשות מקלט בישראל,"הכלל הוא כזה: אם אנחנו מוצאים שזה פליט שברח מסכנת חיים אנחנו נשאיר אותו פה, לא נפקיר אותו למותו [...] אנחנו בודקים את כל הפניות",2018-01-24,"ה כלל הוא כ ה זה אם הוא מצא ש זה פליט ש ברח מ סכנה חיים הוא השאיר את הוא פה , לא הפקיר את הוא ל מוות ... הוא בדק את כול ה פנייה"
יובל שטייניץ,שר האנרגיה הליכוד,4,על ההסכם לקליטת אריתראים וסודנים במדינה שלישית,"גם צרפת יש לה תכנית דומה, וגם איטליה ומדינות אחרות באירופה, של לשלם איזשהו תשלום או תמיכה כלכלית ולהחזיר אנשים לאפריקה",2018-01-23,"גם צרפת יש ל היא תוכנית דומה , ו גם איטליה ו מדינה אחר ב אירופה , של שילם איזה תשלום או תמיכה כלכלי ו החזיר איש ל ה אפריקה"
יואב קיש,סגן שר הבריאות הליכוד,5,על השיקולים המנחים בקביעת הסדר הורות בהצעות החוק לשינוי חזקת הגיל הרך,חכ שולי מועלם הכניסה סעיף שאומר 'מידת הטיפול שהעניק כל אחד מההורים לקטין בשנתיים שקדמו לפירוד'. הסעיף הזה כבר ועדת שניט קבעה שזה לא טובת הילד,2018-01-22,חכ שולי הועלם הכניס סעיף ש אמר מידה ה טיפול ש העניק כול אחד מ ה הורה ל קטין ב שנה ש קדם ל ה פירוד . ה סעיף ה זה כבר ו עדה שניט קיבע ש זה לא טובה ה ילד
מרב מיכאלי,חברת כנסת העבודה,3,על מדיניות מימון ומשך חופשות הלידה בעולם,"מיכאלי: מדינות רבות באירופה נותנות חופשות לידה של יותר משנה וחצי, גם
בן-ארי: על חשבון מי? על חשבון המדינה?
מיכאלי: כן, על חשבון המדינה. 100% על חשבון המדינה. לשני ההורים",2018-01-21,"מיכאלי: מדינות רבות באירופה נותנות חופשות לידה של יותר משנה וחצי, גם
בן-ארי: על חשבון מי? על חשבון המדינה?
מיכאלי: כן, על חשבון המדינה. 100% על חשבון המדינה. לשני ההורים"
יובל שטייניץ,שר האנרגיה הליכוד,4,"על מצב המשק בתקופתו כשר אוצר, לעומת תקופתו של יאיר לפיד",יאיר לפיד קיבל ממני את הכלכלה מספר אחד ב-OECD במערב כולו בצמיחה ובצמיחה לנפש [...] והחזיר כלכלה שירדה רחוק מאוד מהמקום הראשון והטוב שלה,2018-01-20,יאיר לפיד קיבל מן אני את ה כלכלה מ ספר אחד ב ב ה מערב כול ב ה צמיחה ו ב ה צמיחה ל ה נפש ... ו ה חזיר כלכל שירדה רחוק מאוד מ ה מקום ה ראשון ו ה טוב של היא
אלעזר שטרן,חבר כנסת יש עתיד,3,על כהונתם של רבני ערים,זה מצב לא הגיוני שרב עיר נבחר לכל החיים,2018-01-18,זה מצב לא הגיוני ש רב עייר נבחר ל כול ה חיים
מיכל רוזין,חברת כנסת מרצ,2,על מדיניות גירוש הזרים בישראל,"יש למעלה מ-100,000 שוהים בלתי חוקיים במדינת ישראל. רק בשנתיים האחרונות נכנסו למעלה מ-20,000 אוקראינים וביקשו בקשות מקלט [...] דווקא את אותם 38,000 פליטים, מבקשי מקלט מסודן ואריתריאה, מבקשים לגרש [...] מתוך 46,000 שהיו פה בדקו רק 2,000 בקשות מקלט",2018-01-16,"יש ל ה מעלה מ 100,000 שהה בלתי חוקי ב מדינה ישראל . רק ב ה שנה ה אחרון נכנס ל מעלה מ 20,000 אוקראיני ו ביקש בקשה מ קלט ... דווקא את אותו 38,000 פליט , מבקש מקלט מסודן ו אריתריאה , ביקש גירש ... מתוך 46,000 ש היה פה בדק רק 2,000 בקשה מ קלט"
צחי הנגבי,השר לענייני התיישבות הליכוד,4,"על הכרזתו של נשיא ארה""ב דונלד טראמפ בנושא ירושלים","ההחלטה האמריקאית [להכיר בירושלים כבירת ישראל] מתקנת עוול היסטורי אנכרוניסטי, הייתי אומר - מטופש, שהחליטה עליו ארהב ב-1948 - שתל-אביב היא בירת ישראל ולא ירושלים",2018-01-16,"ה החלטה ה אמריקני הכיר ב ירושלים כ בירה ישראל מ תקנה עוול היסטורי אנכרוניסטי , היה אמר מטופש , ש החליט על הוא ארה""ב ב 1948 שתל אביב הוא בירה ישראל ו לא ירושלים"
מיכל רוזין,חברת כנסת מרצ,4,"על מעורבותה של ישראל בניסוח אמנת הפליטים של האו""ם","אנחנו, כמי שיזמנו ב-1948 את אמנת הפליטים, בגלל השואה [...] אנחנו צריכים להיות אלה שאומרים עד כאן",2018-01-16,"הוא , כ מי ש יזם ב 1948 את אמנה ה פליט , בגלל ה שואה ... הוא צריך ל היות אלה ש אמר עד כאן"
זאב אלקין,מועמד לכנסת תקווה חדשה,2,על ההחלטה להצמיד את שכר השרים לשכר הממוצע במשק,"כל אותם חברי כנסת שתקפו אתמול את המהלך הזה מהאופוזיציה, רובם המוחלט לא ויתרו על התוספת שלהם",2018-01-16,"כול אותו חבר כנסת ש תקף אתמול את ה מהלך ה זה מ ה אופוזיציה , רוב ה מוחלט לא ויתר על ה תוספת של הם"
נורית קורן,"יו""ר הוועדה המיוחדת לפרשת היעלמותם של ילדי תימן, המזרח והבלקן הליכוד",4,על שיתוף הפעולה של ויצו עם הוועדה בראשותה לחקר פרשת ילדי תימן,"רק בשבוע הקודם בוצעה פריצת דרך היסטורית ובמסגרתה הגיעו נציגי ויצו, לראשונה בהיסטוריה, לדיוני ועדה בנושא ואף התחייבו לפתוח את כל הארכיונים",2018-01-15,"רק ב ה שבוע ה קודם בוצע פריצה דרך היסטורי ו ב מסגרת הגיע נציג ויצ""ו , לראשונה ב ה היסטוריה , ל דיון ועדה ב ה נושא ו אף התחייב פתח את כול ה ארכיון"
סתיו שפיר,חברת כנסת המחנה הדמוקרטי - התנועה הירוקה,5,על התוכנית לחיזוק כלכלי של הצפון שמקדמת הממשלה,"תוכנית הצפון שהובטחה כבר לפני שנתיים לא נמצאת בתוך התקציב עדיין, למרות ההבטחות",2018-01-11,"תוכנית ה צפון ש הובטח כבר לפני שנה לא נמצא בתוך ה תקציב עדיין , למרות ה הבטחה"
"שי באב""ד","מנכ""ל משרד האוצר",5,על יחס החוב-תוצר בתקופת כהונתו של שר האוצר כחלון,"הדבר הזה הוביל להפחתה של יחס חוב-תוצר בסדרי גודל של 4.5%-4% בשלוש השנים האחרונות, משהו חסר תקדים",2018-01-11,"ה דבר ה זה הוביל ל ה הפחתה של יחס חוב תוצר ב סדר גודל של 4.5 4 ב שלוש ה שנה ה אחרון , משהו חסר הקדים"
זהבה גלאון,"יו""ר המפלגה מרצ",5,"על חוק המרכולים, בעקבות אישורו בכנסת","החוק הזה [חוק המרכולים] הוא חוקף עוקף בגץ דרך אגב, שבגץ כבר אמר עליו ברוב דעות שהוא חוק שפוגע בזכויות יסוד",2018-01-09,"ה חוק ה זה חוק ה מרכול הוא חוקף עוקף ב ה גץ דרך אגב , ש בגץ כבר אמר על הוא ב רוב דעה ש הוא חוק ש פגע ב זכות יסוד"
אורי מקלב,חבר כנסת יהדות התורה,4,על ההיתרים שנתנה עיריית תל אביב למסחר בשבת,"עיריית תל אביב אישרה מאות חנויות מסחר, מסחר שלם בחנויות אלקטרוניקה, בחנויות הלבשה, בחנויות הנעלה, כל החנויות האלה פתוחות",2018-01-08,"עירייה תל אביב אישר מאה חנות מסחר , מ סחר שלם ב חנות אלקטרוניקה , ב חנות הלבשה , ב חנות הנעלה , כול ה חנות ה אלה פתח"
מייקל אורן,חבר כנסת כולנו,3,על מגבלות על מכירת אלכוהול בימי ראשון בארצות הברית,"בניו יורק סיטי, בוושינגטון די-סי - בירת ארצות הברית, אסור למכור אלכוהול ביום ראשון",2018-01-07,"בן ירק סיטי , ב ואשינגטון די סי בירה ארץ ה ברית , אסור מכר אלכוהול ב יום ראשון"
מירי רגב,שרת התחבורה הליכוד,5,"על מסחר בימי מנוחה באירופה, בעקבות קידום חוק המרכולים","גם מי שנוסע לברלין, ללונדון ולפריז יודע שביום ראשון אתה לא עושה קניות. אז מה שטוב שם יכול להיות גם טוב כאן",2018-01-07,"גם מי ש נסע לברלין , ל לונדון ו ל פריז ידע ש ב יום ראשון הוא לא עשה קנייה . אז מה ש טוב שם יכול היה גם טוב כאן"
מיקי רוזנטל,חבר כנסת המחנה הציוני,5,"על השפעת ""חוק לבנת פורן"" על פנייה לייצוג משפטי בתביעות מול ביטוח לאומי",על פי נתוני הביטוח הלאומי מאז חוקק החוק ובגלל שעמלת התיווך הוזלה - יותר משתמשים במייצגים,2018-01-06,על פה נתון ה ביטוח ה לאומי מ אז חוקק ה חוק ו בגלל ש עמלה ה תיווך הוזל יותר השתמש ב ה ייצג
מיכל רוזין,חברת כנסת מרצ,5,על יוזמות עבר לקידום עונש מוות למחבלים,רק לפני חצי שנה העלה יאיר לפיד עם חכ ביטן הצעה אותו הדבר,2018-01-05,רק לפני חץ שנה העלה יאיר לפיד עם חכ ביט הצעה את הוא ה דבר
עמיר פרץ,חבר כנסת העבודה,5,על חוק עונש מוות למחבלים,"השינוי היחיד שהחקיקה עושה הוא שבמקום שגזר דין מוות יתקבל ברוב מוחלט של שלושה שופטים, הוא יוכל להתקבל ברוב של שני שופטים בלבד",2018-01-04,"ה שינוי ה יחיד ש ה חקיקה עשה הוא ש ב ה מקום ש גזר דין מוות התקבל ב רוב מוחלט של שלושה שופט , הוא יכול התקבל ב ה רוב של שני שפט בלבד"
יובל שטייניץ,"שר האנרגיה, הליכוד הליכוד",1,על מדינות בהן קיים עונש מוות,"כל אירופה ביטלה את עונש המוות, כולל רוסיה, חוץ ממדינה אחת. יש היום עונש מוות רק במדינה אחת באירופה - בבלרוס [...] ובמזרח התיכון, המצב בדיוק הפוך. בכל המדינות יש עונש מוות, ורק ישראל היא המדינה היחידה שאין בה עונש מוות",2018-01-03,"כול אירופה ביטל את עונש ה מוות , כולל רוסי , חוץ מ מדינה אחת . יש היום עונש מוות רק ב מדינה אחת ב אירופה ב בלרוס ... ו ב ה מזרח ה תיכון , ה מצב ב דיוק הפוך . ב כול ה מדינה יש עונש מוות , ו רק ישראל הוא ה מדינה ה יחיד ש אין ב היא עונש מוות"
יואב קיש,סגן שר הבריאות הליכוד,5,"על פסיקת בג""ץ בעניין פתיחת מרכולים בשבת","חוק המרכולים הוא חוק שמשמר סטטוס קוו [...] החוק נבע בעקבות פסילת בגץ של חוק דומה שדיבר על כך ששר הפנים יצטרך להמליץ, לתת התייחסותו. בא בגץ ופסל את זה",2018-01-02,"חוק ה מרכול הוא חוק ש משמר סטטוס קיווה ... ה חוק נבע בעקבות פסילה בגץ של חוק דומה ש דיבר על כך ש שר ה פנים הצטרך המליץ , נתן התייחסות . בא ב גץ ו פסל את זה"
יואב בן-צור,"יו""ר סיעה ש""ס",5,על האפשרות להחריג חנויות נוחות בתחנות דלק מחוק המרכולים,"אף אחד לא הגיש הסתייגות [בעניין פתיחת חנויות נוחות בתחנות דלק] [...] תחנות הדלק נמצאות בשטחן של המועצות האזוריות, למועצות האזוריות אין חוק עזר שמחייב אותן לעשות דבר כזה. אין חוקי עזר במועצות אזוריות. שם אין לנו יכולת לומר דבר וחצי דבר",2018-01-02,"אף אחד לא הגיש הסתייגות ב עניין פתיחה חנות נוח ב תחנה דלק ... תחנה ה דלק נמצא ב שטח של ה מועצה ה אזורי , ל ה מועצה ה אזורי אין חוק עזר ש חייב את הן עשה דבר כ ה זה . אין חוק עזר ב מועצה אזורי . שם אין ל אנחנו יכולת אמר דבר ו חץ דבר"
איילת שקד,שרת המשפטים ימינה,5,"על השפעת ""חוק לבנת פורן"" על פנייה לייצוג משפטי בתביעות מול ביטוח לאומי",הנתונים שנאספו מאז חקיקתו מעידים כאלף עדים שהייתה טעות לחוקק אותו. הוא מקשה על נכים לעשות שימוש בחוות דעת ובשירותים משפטיים שיכולים להועיל בהוכחת טענתם מול הביטוח הלאומי,2018-01-01,ה נתון ש נאסף מ אז חקיקה העיד כ אלף עד ש היה טעות ל ה חקק את הוא . הוא מיקש על נכה עשה שימוש ב חווה דעת ו ב שירות משפטי ש יכול הועיל ב הוכחה טענה מול ה ביטוח ה לאומי
מירב בן-ארי,חברת כנסת יש עתיד,5,על חוק המרכולים,"אני לא כל כך נבהלת מהחוק הזה. כי בסוף, הסמכות לסגור עסקים תכלס בשטח נמצאת אצל ראש הרשות. כדי לסגור עסק הוא צריך לשלוח פקחים. עכשיו מה האינטרס של אותו ראש רשות, לשלוח פקחים שאגב רובם אני מניחה יהודים [...] שהם בכלל לא ילכו ויסגרו וגם בכלל לא עובדים בשבת",2018-01-01,"הוא לא כול כך נבהל מ ה חוק ה זה . כי ב ה סוף , ה סמכות סגר עסק תכלס ב ה שטח נמצא אצל ראש ה רשות . כדי סגר עסק הוא צריך שלח פקח . עכשיו מה ה אינטרס של את הוא ראש רשות , שלח פקח ש אגב רוב הוא הניח יהודי ... ש הוא בכלל לא הלך ו נסגר ו גם בכלל לא עבד ב ה שבת"
מיכל רוזין,חברת כנסת מרצ,1,על הבנייה בשטחי יהודה ושומרון,"מ-1995 עד היום נבנו פחות מ-50 אלף יחידות דיור בגדה המערבית [...] זה לא שאני לא מוטרדת מהבנייה, ולא שאני לא מוטרדת מ-400 אלף ישראלים שגרים מעבר לקו הירוק",2018-01-01,"מ 1995 עד ה יום נבנה פחות מ 50 אלף יחידה דיור ב ה גדה ה מערבי ... זה לא ש הוא לא הוטרד מ ה בנייה , ו לא ש הוא לא הוטרד מ 400 אלף ישראלי ש גר מעבר ל ה קו ה ירוק"
איציק שמולי,"ח""כ העבודה",1,על מיסוי תרופות מצילות חיים שאינן כלולות בסל הבריאות,"כל זמן שהתרופה לא בסל, המדינה מוסיפה חטא על פשע. היא לוקחת מעמ על תרופות שהורים קונים בחול כדי לספק אותן לילדים שלהם",2017-12-31,"כול זמן ש ה תרופה לא ב ה סל , ה מדינה הוסיף חטא על פשע . הוא לקח מ עמ על תרופה ש הורה קנה ב ה חול כדי סיפק את הן ל ה ילד של הם"
מיקי זוהר,"יו""ר הקואליציה הליכוד",5,על החלטת ועדת האתיקה לגבי פעולתו בוועדה שבראשותו,כמובן שהטיעון הזה הופרך לחלוטין על ידי ועדת האתיקה - אגב אמר את זה אתמול גם יור ועדת האתיקה במהלך הדיון לגברת שפיר - שאני לא פעלתי בשום דבר שהוא קשור לניגוד עניינים ואני נקי כפיים,2017-12-27,כמובן ש ה טיעון ה זה הופרך לחלוטין על יד ועדה ה אתיקה אגב אמר את זה אתמול גם יור ו עדה ה אתיקה ב מהלך ה דיון ל גברת שפיר ש הוא לא פעל ב שום דבר ש הוא קשר ל ניגוד עניין ו אני נקי כף
יאיר לפיד,"ראש האופוזיציה יש עתיד-תל""ם",5,על המשא ומתן בנושא ירושלים,"״בפעם הראשונה והאחרונה שמישהו הציע להם לדון בחלוקת ירושלים, שזה אהוד ברק בדצמבר 2000, שגם זרק פנימה לסל 95% משטחי הגדה, הם אמרו ׳לא׳, והתחילו את האינתיפאדה השנייה",2017-12-27,"ב ה פעם ה ראשון ו ה אחרון ש מישהו הציע ל הם דן ב חלוקה ירושלים , ש זה אהוד ב רק בדצמבר 2000 , ש גם זרק פנימה ל סל 95 משטח ה גדה , הוא אמר לא , ו התחייל את ה אינתיפאדה ה שני"
מיקי זוהר,"יו""ר הקואליציה הליכוד",5,על הגידול בתקציב הביטחון בזמן כהונת נתניהו כראש ממשלה,"התקציב הביטחוני שעלה בשנים האחרונות, לא היה כזה דבר מעולם. וזה פעולתו של בנימין נתניהו. כי זה באמת הבייבי שלו, הנושא של ביטחון אזרחי ישראל",2017-12-26,"ה תקציב ה בטחוני ש עלה ב ה שנה ה אחרון , לא היה כ ה זה דיבר מעולם . ו זה פעולה של בנימין נתניהו . כי זה באמת ה בייבי של הוא , ה נושא של ביטחון אזרח ישראל"
מיקי זוהר,"יו""ר הקואליציה הליכוד",5,על החשדות נגד בנימין נתניהו,"בוא תיתן לי דבר אחד שראש הממשלה חשוד בו, שיש בו מונח של שחיתות. האם יש משהו בדברים שראש הממשלה חשוד בהם שיש בהם רבב של שחיתות?",2017-12-26,"בוא נתן ל אני דבר אחד ש ראש ה ממשלה חשד ב הוא , ש יש ב הוא מונח של שחיתות . האם יש משהו ב ה דבר ש ראש ה ממשלה חשד ב הוא ש יש ב ה הוא רבב של שחיתות ?"
יעקב ליצמן,שר הבריאות יהדות התורה,5,על יוזמתו שראשי ממשלה יידרשו להיות בעלי ניסיון צבאי או תואר אקדמי,"ליצמן: ראש ממשלה, צריך להיות לו ניסיון עשיר בקרבי, בצבא, בנושא הצבאי
הילה קורח: למה? היו הרי שרי ביטחון שלא היו קרביים
ליצמן: לא היו. כולם היו פחות או יותר, ידעו את זה, היו מעורבים, כולם מאז קום המדינה
 ",2017-12-26,"ליצמן: ראש ממשלה, צריך להיות לו ניסיון עשיר בקרבי, בצבא, בנושא הצבאי
הילה קורח: למה? היו הרי שרי ביטחון שלא היו קרביים
ליצמן: לא היו. כולם היו פחות או יותר, ידעו את זה, היו מעורבים, כולם מאז קום המדינה
 "
צחי הנגבי,השר לענייני התיישבות הליכוד,1,על הטענה שחוק ההמלצות יחול על נתניהו אם יוזמן לחקירה בתיק הצוללות,"[החקירה בתיק הצוללות] נפתחה לפני זמן רב. היא נמצאת בעיצומה, מאות אנשים העידו בה. כך שחוק ההמלצות לא חל עליה",2017-12-26,"ה חקירה ב תיק ה צולל נפתח לפני זמן רב . הוא נמצא ב עיצום , מאה איש העיד ב היא . כך ש חוק ה המלצה לא חל על היא"
יאיר לפיד,"ראש האופוזיציה יש עתיד-תל""ם",5,על השפעת חוק ההמלצות במקרה שנתניהו יוזמן לחקירה בתיק הצוללות,החוק הזה [חוק ההמלצות] רלוונטי לגמרי. מפני שכל המטרה שלהם זה שהחוק יעבור לפני שנתניהו יוזמן לחקירה בפרשת הצוללות,2017-12-26,ה חוק ה זה חוק ה המלצה רלוונטי לגמרי . מפני ש כול ה מטרה של הם זה ש ה חוק עבר לפני ש נתניהו הוזמן ל חקירה ב פרשה ה צולל
בצלאל סמוטריץ׳,"יו""ר האיחוד הלאומי ימינה",5,"על טענותיו לליקויים בהליך מינוי קב""ט בלשכת מבקר המדינה בחיפה","שאלתי את המבקר [...] למה כל משרדי הממשלה צריכים למנות קב״ט במכרז פומבי מסודר, ואתה מבקש פטור ממכרז? [...] לא היו בפיו הסברים מניחים את הדעת, ולכן חבריי בוועדה קיבלו את דעתי ואנחנו סירבנו לאשר את הבקשה ושלחנו את המבקר לבצע מכרז",2017-12-25,"שאל את ה מבקר ... למה כול משרד ה ממשלה צריך מנה קב ט ב מכרז פומבי מסודר , ו הוא ביקש פטור מ מכרז ? ... לא היה ב פה הסבר הניח את ה דעת , ו לכן חבר ב ה ועדה קיבל את דעה ו הוא סירב אישר את ה בקשה ו שלח את ה מבקר ל ה בצע מכרז"
